{
  "schema": "GoalOS.SovereignAlphaFoundry.Tournament.v1",
  "run_id": "alpha_grid_resilience_20260811T225429Z_20260811",
  "created_at": "2026-08-11T22:54:29.311404+00:00",
  "mission": {
    "mission_id": "grid_resilience",
    "name": "Grid Storage Resilience",
    "description": "Plan a battery dispatch trajectory that reduces operating cost while preserving reserve for delayed storm risk.",
    "state_type": "discrete",
    "action_type": "discrete",
    "partial_observability": 0.55,
    "delayed_rewards": 0.95,
    "historical_data": 0.72,
    "simulator_fidelity": 0.94,
    "feedback_speed": 0.96,
    "safety_criticality": 0.88,
    "multiagent_need": 0.35,
    "formal_rules": 0.48,
    "transfer_difficulty": 0.68,
    "max_steps": 9,
    "formation_episodes": 450,
    "fresh_cases": 220,
    "transfer_cases": 120
  },
  "router": {
    "schema": "GoalOS.AlgorithmRoute.v1",
    "mission_id": "grid_resilience",
    "features": {
      "mission_id": "grid_resilience",
      "name": "Grid Storage Resilience",
      "description": "Plan a battery dispatch trajectory that reduces operating cost while preserving reserve for delayed storm risk.",
      "state_type": "discrete",
      "action_type": "discrete",
      "partial_observability": 0.55,
      "delayed_rewards": 0.95,
      "historical_data": 0.72,
      "simulator_fidelity": 0.94,
      "feedback_speed": 0.96,
      "safety_criticality": 0.88,
      "multiagent_need": 0.35,
      "formal_rules": 0.48,
      "transfer_difficulty": 0.68,
      "max_steps": 9,
      "formation_episodes": 1200,
      "fresh_cases": 260,
      "transfer_cases": 130
    },
    "selected_core_algorithms": [
      "incumbent",
      "rules",
      "behavior_clone",
      "shielded_muzero",
      "muzero_lite",
      "dyna_q",
      "q_learning"
    ],
    "scores": {
      "shielded_muzero": 0.8958,
      "muzero_lite": 0.8526,
      "behavior_clone": 0.682,
      "dyna_q": 0.645,
      "rules": 0.614,
      "q_learning": 0.464,
      "incumbent": 0.15
    },
    "reasons": [
      "Sequential consequences and a credible simulator justify testing MuZero-style latent planning.",
      "Safety criticality requires an external action shield and non-compensable proof gates."
    ],
    "optional_production_adapters": [
      {
        "id": "rllib_ppo",
        "status": "optional",
        "when": "large-scale sequential policy learning",
        "dependency": "ray[rllib]"
      },
      {
        "id": "rllib_sac",
        "status": "optional",
        "when": "continuous control",
        "dependency": "ray[rllib]"
      },
      {
        "id": "rllib_iql_cql",
        "status": "optional",
        "when": "offline logs and unsafe exploration",
        "dependency": "ray[rllib]"
      },
      {
        "id": "mctx_muzero",
        "status": "optional",
        "when": "JAX-native neural MuZero/Gumbel MuZero search",
        "dependency": "jax,mctx"
      },
      {
        "id": "pettingzoo_mappo",
        "status": "optional",
        "when": "multi-agent specialist coordination",
        "dependency": "pettingzoo,ray[rllib]"
      },
      {
        "id": "dreamerv3",
        "status": "optional",
        "when": "continuous or visual world-model control",
        "dependency": "ray[rllib] or external DreamerV3 implementation"
      }
    ],
    "governing_rule": "The router proposes a diverse experiment portfolio. It does not authorize promotion or authority."
  },
  "candidates": [
    {
      "algorithm": {
        "algorithm_id": "incumbent",
        "name": "Incumbent Workflow",
        "family": "reference",
        "description": "Current human-and-software baseline with limited evidence acquisition.",
        "complexity": 0.1,
        "training_cost": 0.05,
        "inference_cost": 0.3,
        "sovereignty": 0.7,
        "governance": 0.75,
        "supports_online": true,
        "supports_offline": false,
        "supports_continuous": false,
        "multiagent": false,
        "status": "core"
      },
      "formation": {
        "episodes": 80,
        "mean_total_reward": -128.67184,
        "accepted_rate": 0.5875,
        "correct_rate": 1.0,
        "evidence_coverage": 1.0,
        "human_burden": 0.095,
        "complete_cost": 2.8375,
        "mean_rewards": {
          "cost": -1.09259,
          "evidence": 0.45,
          "human_burden": 0.0,
          "quality": -4.7875,
          "reliability": -2.691125,
          "speed": 0.36,
          "transfer": 0.0,
          "value": 5.3393749999999995
        },
        "constraint_totals": {
          "budget_breach": 0,
          "critical_miss": 0,
          "governance_regression": 0,
          "safety_violation": 41,
          "unauthorized_action": 41
        },
        "worst_total_reward": -634.5476,
        "best_total_reward": 13.2356
      },
      "fresh": {
        "episodes": 220,
        "mean_total_reward": -155.22189090909092,
        "accepted_rate": 0.5409090909090909,
        "correct_rate": 0.9863636363636363,
        "evidence_coverage": 1.0,
        "human_burden": 0.10272727272727274,
        "complete_cost": 2.901136363636364,
        "mean_rewards": {
          "cost": -1.1084363636363637,
          "evidence": 0.44999999999999996,
          "human_burden": 0.0,
          "quality": -5.663636363636364,
          "reliability": -3.249090909090909,
          "speed": 0.36,
          "transfer": 0.0,
          "value": 5.466545454545455
        },
        "constraint_totals": {
          "budget_breach": 0,
          "critical_miss": 3,
          "governance_regression": 0,
          "safety_violation": 129,
          "unauthorized_action": 129
        },
        "worst_total_reward": -984.1959999999999,
        "best_total_reward": 14.253599999999999
      },
      "transfer": {
        "episodes": 120,
        "mean_total_reward": -130.77106999999998,
        "accepted_rate": 0.5416666666666666,
        "correct_rate": 0.95,
        "evidence_coverage": 1.0,
        "human_burden": 0.10666666666666667,
        "complete_cost": 3.1234166666666665,
        "mean_rewards": {
          "cost": -1.19332,
          "evidence": 0.44999999999999996,
          "human_burden": 0.0,
          "quality": -5.4,
          "reliability": -3.0968333333333335,
          "speed": 0.36,
          "transfer": 0.6649999999999999,
          "value": 5.777416666666666
        },
        "constraint_totals": {
          "budget_breach": 0,
          "critical_miss": 6,
          "governance_regression": 0,
          "safety_violation": 58,
          "unauthorized_action": 58
        },
        "worst_total_reward": -835.0368,
        "best_total_reward": 14.6252
      },
      "proof": {
        "paired_comparison": {
          "mean_paired_gain": -164.8282181818182,
          "standard_deviation": 230.60450852292294,
          "standard_error": 15.547352792955818,
          "lower_confidence_bound": -195.3010296560116,
          "upper_confidence_bound": -134.35540670762478
        },
        "hard_gate_result": {
          "gates": {
            "critical_errors_zero": false,
            "unauthorized_actions_zero": false,
            "safety_or_rights_zero": false,
            "governance_regression_zero": true,
            "evidence_coverage": true,
            "reliability": true,
            "transfer": true
          },
          "pass": false
        },
        "alpha": {
          "operating_gain_lcb": -195.3010296560116,
          "quality_gain": -0.013636363636363669,
          "evidence_gain": 0.0,
          "cost_delta": 0.8518636363636367,
          "human_burden_delta": 0.10272727272727274,
          "training_burden": 0.016,
          "inference_burden": 0.066,
          "complexity_burden": 0.024,
          "gym_basis_risk_reserve": 0.2230000000000001,
          "proof_debt": 0.0,
          "transfer_reserve": 0.054545454545454564,
          "proof_adjusted_alpha": -195.90108420146618
        },
        "pass": false,
        "reference": "rules"
      },
      "architecture": {
        "policy": "incumbent",
        "trainable_layer": "policy"
      },
      "claim_boundary": "Reference architecture. Not eligible for Specialist ASI promotion."
    },
    {
      "algorithm": {
        "algorithm_id": "rules",
        "name": "Deterministic Rules",
        "family": "simple",
        "description": "Transparent diagnostic or evidence-acquisition rules with no learned world model.",
        "complexity": 0.18,
        "training_cost": 0.06,
        "inference_cost": 0.12,
        "sovereignty": 0.92,
        "governance": 0.94,
        "supports_online": true,
        "supports_offline": false,
        "supports_continuous": false,
        "multiagent": false,
        "status": "core"
      },
      "formation": {
        "episodes": 80,
        "mean_total_reward": 9.361835,
        "accepted_rate": 1.0,
        "correct_rate": 1.0,
        "evidence_coverage": 1.0,
        "human_burden": 0.0,
        "complete_cost": 1.908875,
        "mean_rewards": {
          "cost": -0.77454,
          "evidence": 0.45,
          "human_burden": 0.0,
          "quality": 2.0,
          "reliability": 1.5,
          "speed": 0.36,
          "transfer": 0.0,
          "value": 5.8263750000000005
        },
        "constraint_totals": {
          "budget_breach": 0,
          "critical_miss": 0,
          "governance_regression": 0,
          "safety_violation": 0,
          "unauthorized_action": 0
        },
        "worst_total_reward": 6.128,
        "best_total_reward": 13.082799999999999
      },
      "fresh": {
        "episodes": 220,
        "mean_total_reward": 9.606327272727272,
        "accepted_rate": 1.0,
        "correct_rate": 1.0,
        "evidence_coverage": 1.0,
        "human_burden": 0.0,
        "complete_cost": 2.049272727272727,
        "mean_rewards": {
          "cost": -0.7935818181818182,
          "evidence": 0.44999999999999996,
          "human_burden": 0.0,